{
  "schema_version": 1,
  "dimensions": [
    {
      "id": "information_architecture",
      "label": "Information architecture",
      "anchors": {
        "1": "Related information is scattered with no discernible grouping; the reader must hunt across the whole page to assemble any one concept.",
        "3": "Basic grouping exists (e.g. issuer vs. customer are visually separate) but placement is inconsistent or some related fields are still split across distant regions.",
        "4": "Every field lives in one clearly bounded group matching the domain's natural structure, each in an expected location.",
        "5": "Grouping is clear AND the zones are ordered to match the reader's natural scanning path, so the reader never backtracks to find related information."
      }
    },
    {
      "id": "content_hierarchy",
      "label": "Content hierarchy",
      "anchors": {
        "1": "Every field has the same size/weight; no single fact stands out from the rest.",
        "3": "Some size/weight variation exists, but the one fact the reader needs first is not clearly the most prominent element on the page.",
        "4": "The one fact the reader needs first is visually dominant — larger and/or bolder than everything else.",
        "5": "The key fact is dominant AND every other element recedes in proportion to its importance, producing one unambiguous focal point."
      }
    },
    {
      "id": "domain_fit",
      "label": "Domain-fit / least-surprise",
      "anchors": {
        "1": "The layout could be mistaken for a different kind of document entirely; it lacks the conventional elements a reader expects for this document type.",
        "3": "The document is recognizable as the right family but is missing one or more conventional elements a reader would expect.",
        "4": "The document includes and positions the conventional elements a reader of this domain expects.",
        "5": "The document is indistinguishable in structure and convention from a real-world professional document of this type."
      }
    },
    {
      "id": "reader_affordances",
      "label": "Reader affordances",
      "anchors": {
        "1": "No navigational aids exist — a wall of unlabeled text or numbers with no alignment or whitespace to guide scanning.",
        "3": "Some labels exist, but alignment or whitespace is inconsistent.",
        "4": "Labels, alignment, and whitespace are applied consistently throughout.",
        "5": "Affordances actively anticipate the reader's exact scanning path."
      }
    },
    {
      "id": "typographic_craft",
      "label": "Typographic craft",
      "anchors": {
        "1": "Type sizing/weight is arbitrary or inconsistent; text is cramped, overflowing, or wrapped awkwardly.",
        "3": "Sizing/weight is mostly consistent, but a few awkward line breaks or spacing issues remain.",
        "4": "Sizing, weight, and spacing are consistent throughout with no awkward breaks.",
        "5": "Every typographic choice reads as intentional — a coherent, deliberate type system with zero awkward breaks."
      }
    },
    {
      "id": "restraint_cohesion",
      "label": "Restraint / cohesion",
      "anchors": {
        "1": "The document is visually noisy or internally inconsistent across sections.",
        "3": "The document is mostly restrained, but one or two decorative inconsistencies remain.",
        "4": "The document is fully restrained and internally consistent.",
        "5": "The document is restrained, consistent, AND every visual element earns its place — nothing could be removed without losing information."
      }
    }
  ],
  "gates": [
    {
      "id": "reading_order",
      "label": "Reading order",
      "description": "The rendered PDF's content reads top-to-bottom, left-to-right in the same order a human would naturally scan it, with no illogical jumps between regions. Pass/fail, no partial credit."
    },
    {
      "id": "print_safety",
      "label": "Print safety",
      "description": "The document renders correctly at its actual print/paper size: no clipped text or table columns at page margins, and no essential content lost or orphaned across a page break. Pass/fail, no partial credit."
    }
  ],
  "thresholds": {
    "hierarchy_dimension": "content_hierarchy",
    "hierarchy_min": 5,
    "core_min": 4
  },
  "stress_exemption": {
    "exempt": true,
    "reason": "Stress-matrix fixtures (test/rendro/edge_matrix_test.exs) exist to prove pipeline robustness and byte-determinism under adversarial inputs -- overflow, extreme text length, empty/60+ line-item counts, numeric edge cases, currency and page-size variance -- not reader-facing aesthetic quality. They are deliberately excluded from the reader-quality rubric's beauty gate; the gate applies only to curated family x domain demonstration documents.",
    "fixture_source": "test/rendro/edge_matrix_test.exs",
    "gate_scope": "scores"
  },
  "scores": [
    {
      "demo_id": "invoice-acme-phoenix-saas",
      "domain": "invoice",
      "family": "invoice",
      "dimension_scores": {
        "information_architecture": 5,
        "content_hierarchy": 5,
        "domain_fit": 5,
        "reader_affordances": 4,
        "typographic_craft": 4,
        "restraint_cohesion": 4
      },
      "gate_results": {
        "reading_order": true,
        "print_safety": true
      },
      "passed": true,
      "recorded_at": "2026-08-20",
      "reviewer": "jon",
      "png_sha256": "6a7dfd0c963c2bfaddf2bf3e8dedc7f7deef3848a5d91478dae40cc310f49a47",
      "source_pdf_sha256": "8808fcf899c5ac5897e5fa1bf7316924edca275ce85f8ec3410f5576f3d5fc22",
      "signed_off_by": "phase-126-full-size-review",
      "signed_off_at": "2026-08-17",
      "evidence_ref": "assets/rendro/gallery/invoice.png",
      "justifications": {
        "information_architecture": "Issuer letterhead, then a bounded Bill To/date/due/terms block, then the line-item table, then subtotal/tax/total — each zone bounded and ordered to match the reader's natural top-to-bottom scan (who's billing -> who's billed/when -> what for -> how much) with no backtracking.",
        "content_hierarchy": "The historical default/0 gallery score remains 5. Phase 126 additionally reviewed the exact pinned-PDFium swiss_invoice_light and corporate_classic_invoice_dark page-one rows at full readable size: the dark table header and body values were readable, while Total Due remains the bounded page focal point. This is a six-row repair review only, not a WCAG, PDF/UA, print-safety, or universal preset-quality claim.",
        "domain_fit": "Issuer address, invoice number, bill-to, due date, payment terms (Net 30), itemized qty/price table, and subtotal/tax/total breakdown together read as a real small-business invoice, not a toy layout.",
        "reader_affordances": "Item/Qty/Price column headers, consistent column alignment, and a clearly labeled subtotal/tax/total stack make the math easy to trace.",
        "typographic_craft": "Consistent 2-decimal money throughout (the prior $79.0 defect is gone); one item description wraps to a second line but wraps cleanly at a word boundary with no overlap or orphan.",
        "restraint_cohesion": "Restrained and internally consistent; no decorative noise. The lower two-thirds of the page is blank because the fixture has only 5 line items — empty space, not visual clutter."
      },
      "domain_md": "priv/examples/invoice/DOMAIN.md"
    },
    {
      "demo_id": "statement-northwind-ledger-co",
      "domain": "statement",
      "family": "statement",
      "dimension_scores": {
        "information_architecture": 5,
        "content_hierarchy": 5,
        "domain_fit": 5,
        "reader_affordances": 4,
        "typographic_craft": 4,
        "restraint_cohesion": 4
      },
      "gate_results": {
        "reading_order": true,
        "print_safety": true
      },
      "passed": true,
      "recorded_at": "2026-08-20",
      "reviewer": "jon",
      "png_sha256": "b0475e73540b93bcae88f925228a0c7fe31b17d25e1ccd154b62e699308cb31b",
      "source_pdf_sha256": "d3380c80468ce7a384ac2a54c2b2500a6b8f14b65c3751c12d6b7bf406e445d5",
      "signed_off_by": "phase-126-full-size-review",
      "signed_off_at": "2026-08-17",
      "evidence_ref": "assets/rendro/gallery/statement.png",
      "justifications": {
        "information_architecture": "Account header, statement period, and opening balance are grouped, immediately followed by the boxed closing-balance summary, then the transaction ledger — matching the way a statement reader actually scans (bottom line first, then verify against detail).",
        "content_hierarchy": "Re-measured against the themed default/0 raster blessed in 123-03: the boxed 'Closing balance $6,647.56' (display, 21pt themed) computes to 25.9px vs. 'Northwind Ledger Co - Operating Account ****8140' (title, 16.5pt themed) at 20.4px — a 1.27 ratio. Closing balance remains the single largest, unambiguous focal point. Human sign-off 2026-07-28 confirmed dominance on the actual rendered raster — the 2026-07-19 native-scale numbers (26px/19px) no longer describe this render and are superseded here.",
        "domain_fit": "Masked account number, statement period, opening balance, boxed closing balance, and a running-balance ledger with parenthesized debits read as a conventional bank/ledger statement.",
        "reader_affordances": "Clear Date/Description/Amount/Balance columns with a running balance make it easy to trace any line.",
        "typographic_craft": "Consistent money formatting and clean alignment throughout, including the closing-balance box.",
        "restraint_cohesion": "Restrained, cohesive, no decorative noise."
      },
      "domain_md": "priv/examples/statement/DOMAIN.md"
    },
    {
      "demo_id": "receipt-harbor-and-oak-cafe",
      "domain": "receipt",
      "family": "receipt",
      "dimension_scores": {
        "information_architecture": 5,